<xs:schema xmlns:xs="http://www.w3.org/2001/XMLSchema">
    <xs:element name="events">
        <xs:complexType>
            <xs:sequence>
                <xs:element name="event" maxOccurs="unbounded">
                    <xs:complexType>
                        <xs:sequence>
                            <xs:element name="name" type="xs:string"/>
                            <xs:element name="date" type="xs:string"/>
                            <xs:element name="venue" type="xs:string"/>
                            <xs:element name="maxMembers" type="xs:integer"/>
                        </xs:sequence>
                    </xs:complexType>
                </xs:element>
            </xs:sequence>
        </xs:complexType>
    </xs:element>
</xs:schema>
